### ISSUE TITLE
Email environment variable settings not working

### ISSUE THREAD

**Issue by cameronpd** [cgwire/zou#143]
Hi,

I've tried using the MAIL_SERVER, MAIL_DEBUG, MAIL_DEFAULT_SENDER and DOMAIN_NAME environment variable settings in the systemd services file, but the defaults from zou/app/config.py are always used. I tried editing the defaults in the config.py and that worked.

I used tcpdump verify that zou was trying to connect to the stmp port on localhost.

The DB_, KV_ and SECRET_KEY variables all work fine from what I've tried so far.

Running:
zou 0.9.21
on Fedora 29 
with Python 3.7.2

Thanks.

**Comment by frankrousseau** [comment]
We use all these variables in production. Are you sure you specifiied them correctly?

**Comment by frankrousseau** [comment]
`MAIL_USERNAME` is required too.

**Comment by cameronpd** [comment]
Ok, I assumed it would fall back to the default if I didn't need a settings. 
However, even when supplying every setting in the systemd service file it still doesn't work.

I think I'm setting them correctly, I'm using DB_HOST, DB_USERNAME, DB_PASSWORD and KV_HOST without issue. 

This is what I've just tested in the services file for the email settings:

```
Environment="MAIL_SERVER=mail.local"
Environment="MAIL_PORT=25"
Environment="MAIL_USERNAME="
Environment="MAIL_PASSWORD="
Environment="MAIL_DEBUG=0"
Environment="MAIL_USE_TLS=False"
Environment="MAIL_USE_SSL=False"
Environment="MAIL_DEFAULT_SENDER=no-reply@mail.local"
Environment="DOMAIN_NAME=kitsu.local"
```

As you can see bellow, it's trying to connect localhost, not mail.local
<details>
<summary>Error log output:</summary>

```python

[2019-03-21 11:57:45,179] ERROR in __init__: Traceback (most recent call last):
  File "/opt/zou/zouenv/lib/python3.7/site-packages/flask/app.py", line 1612, in full_dispatch_request
    rv = self.dispatch_request()
  File "/opt/zou/zouenv/lib/python3.7/site-packages/flask/app.py", line 1598, in dispatch_request
    return self.view_functions[rule.endpoint](**req.view_args)
  File "/opt/zou/zouenv/lib/python3.7/site-packages/flask_restful/__init__.py", line 477, in wrapper
    resp = resource(*args, **kwargs)
  File "/opt/zou/zouenv/lib/python3.7/site-packages/flask/views.py", line 84, in view
    return self.dispatch_request(*args, **kwargs)
  File "/opt/zou/zouenv/lib/python3.7/site-packages/flask_restful/__init__.py", line 587, in dispatch_request
    resp = meth(*args, **kwargs)
  File "/opt/zou/zouenv/lib/python3.7/site-packages/zou/app/blueprints/auth/resources.py", line 534, in post
    mail.send(message)
  File "/opt/zou/zouenv/lib/python3.7/site-packages/flask_mail.py", line 491, in send
    with self.connect() as connection:
  File "/opt/zou/zouenv/lib/python3.7/site-packages/flask_mail.py", line 144, in __enter__
    self.host = self.configure_host()
  File "/opt/zou/zouenv/lib/python3.7/site-packages/flask_mail.py", line 158, in configure_host
    host = smtplib.SMTP(self.mail.server, self.mail.port)
  File "/usr/lib64/python3.7/smtplib.py", line 251, in __init__
    (code, msg) = self.connect(host, port)
  File "/usr/lib64/python3.7/smtplib.py", line 336, in connect
    self.sock = self._get_socket(host, port, self.timeout)
  File "/usr/lib64/python3.7/smtplib.py", line 307, in _get_socket
    self.source_address)
  File "/opt/zou/zouenv/lib/python3.7/site-packages/gevent/socket.py", line 96, in create_connection
    sock.connect(sa)
  File "/opt/zou/zouenv/lib/python3.7/site-packages/gevent/_socket3.py", line 335, in connect
    raise error(err, strerror(err))
ConnectionRefusedError: [Errno 111] Connection refused
```
</details>

<details>
<summary>tcpdump output:</summary>

```
# tcpdump -i any port 25
tcpdump: verbose output suppressed, use -v or -vv for full protocol decode
listening on any, link-type LINUX_SLL (Linux cooked), capture size 262144 bytes
12:36:11.272205 IP6 localhost.59278 > localhost.smtp: Flags [S], seq 3341184959, win 65476, options [mss 65476,sackOK,TS val 1983206706 ecr 0,nop,wscale 7], length 0
12:36:11.272230 IP6 localhost.smtp > localhost.59278: Flags [R.], seq 0, ack 3341184960, win 0, length 0
12:36:11.272467 IP localhost.39082 > localhost.smtp: Flags [S], seq 570283946, win 65495, options [mss 65495,sackOK,TS val 1289422104 ecr 0,nop,wscale 7], length 0
12:36:11.272482 IP localhost.smtp > localhost.39082: Flags [R.], seq 0, ack 570283947, win 0, length 0

```
</details>

**Comment by frankrousseau** [comment]
Are you sure that something is running on `mail.local:25`?

**Comment by cameronpd** [comment]
Yes, as I said, if I edit zou/app/config.py and change the default localhost to mail.local it works fine. Also if I `telnet mail.local 25` that works as well, although I can't show that till I get into work tomorrow, but that was my first test.

 Just to be clear mail.local is a physically different machine and has been in use as a mail server for a few months.

I don't understand why the DB_ ones work and the MAIL_ don't, hence this ticket and while I only starting learning python a few months ago I've been using linux for 22 year and was linux & network engineer/administrator for 15 of those, so I'm not completely clueless, but mistakes can be made.

Out of interesting I'll try the LDAP settings tomorrow and try connecting to our samba AD server, as I updated to zou 0.9.23 today.

**Comment by frankrousseau** [comment]
Sorry I didn't mean to offend you. I'm just trying to understand what is happening. We use the same environment variables as you on our hosting infrastructure and it works well. You can see too that the code is straightforward and that default values are set in case you don't set them yourself. 
So, before digging further, I wanted to check that nothing was missing in your installation.

About the LDAP configuration, we added a new env variable `LDAP_IS_AD`. If you are using Active directory, it must be set to True. The documentation is not up to date yet.

**Comment by cameronpd** [comment]
Don't worry about it, I wasn't offended, just mildly annoyed. I didn't have time to write a proper reply on Friday so I just closed the the ticket, but I've resolved the issue. I was using the cockpit web console to restart the zou service and cockpit was suppressing a systemd warning message, that said exactly what was wrong and what to do to fix it. Add that to my lack of systemd knowledge and a very simple problem could have been avoided.  Sorry about the complete waste of time.

**Comment by frankrousseau** [comment]
No worry debugging is always frustrating :) If your studio uses Kitsu, would you allow us to display your logo on our home page?

**Comment by krishme** [comment]
I have hosted zou locally for testing, I am having problem with emailing, went through the documentation but could not find the config file, could you please help me with this

**Comment by ddesmond** [comment]
@krishme maybe this gist can help you out. https://gist.github.com/ddesmond/565802d4ba687c0c04a54246270d50b7
